<?xml version="1.0" encoding="utf-8"?>
<schema xmlns:xsi="http://www.w3.org/2001/XMLSchema-instance" xsi:schemaLocation="http://www.ensignos.com/schema ../../main/webapp/schemas/schema.xsd">
    <name>SchemaOne</name>
    <version>0.1</version>
    <creationDate>2013-06-15</creationDate>
    <columns>
        <column>
            <dataType>STRING</dataType>
            <type>DIMENSION</type>
            <name>Code</name>
        </column>
        <column>
            <dataType>STRING</dataType>
            <type>DIMENSION</type>
            <name>Name</name>
        </column>
        <column>
            <dataType>STRING</dataType>
            <type>DIMENSION</type>
            <name>Continent</name>
        </column>
        <column>
            <dataType>STRING</dataType>
            <type>DIMENSION</type>
            <name>Region</name>
        </column>
        <column>
            <dataType>DOUBLE</dataType>
            <type>MEASURE</type>
            <name>SurfaceArea</name>
        </column>
        <column>
            <dataType>YEAR</dataType>
            <type>DIMENSION</type>
            <name>IndepYear</name>
        </column>
        <column>
            <dataType>INTEGER</dataType>
            <type>MEASURE</type>
            <name>Population</name>
        </column>
        <column>
            <dataType>DOUBLE</dataType>
            <type>MEASURE</type>
            <name>LifeExpectancy</name>
        </column>
        <column>
            <dataType>DOUBLE</dataType>
            <type>MEASURE</type>
            <name>GNP</name>
        </column>
        <column>
            <dataType>DOUBLE</dataType>
            <type>MEASURE</type>
            <name>GNPOld</name>
        </column>
        <column>
            <dataType>STRING</dataType>
            <type>TEXT</type>
            <name>LocalName</name>
        </column>
        <column>
            <dataType>STRING</dataType>
            <type>DIMENSION</type>
            <name>GovernmentForm</name>
        </column>
        <column>
            <dataType>STRING</dataType>
            <type>TEXT</type>
            <name>HeadOfState</name>
        </column>
        <column>
            <dataType>INTEGER</dataType>
            <type>TEXT</type>
            <name>Capital</name>
        </column>
        <column>
            <dataType>STRING</dataType>
            <type>TEXT</type>
            <name>Code2</name>
        </column>
    </columns>
</schema>
