<?xml version="1.0" encoding="UTF-8"?>
<schema xmlns:xsi="http://www.w3.org/2001/XMLSchema-instance" xsi:schemaLocation="http://www.ensignos.com/schema ../../main/webapp/schemas/schema.xsd">
		<name>SchemaName</name>
		<version>0.1</version>
		<creationDate>2013-06-15</creationDate>
		<columns>
			<column>
				<dataType>STRING</dataType>
				<type>DIMENSION</type>
				<name>String</name>
			</column>
			<column>
				<dataType>EMAIL</dataType>
				<type>TEXT</type>
				<name>Email</name>
				<indexed>true</indexed>
			</column>
			<column>
				<dataType>URL</dataType>
				<type>TEXT</type>
				<name>Url</name>
			</column>
			<column>
				<dataType>INTEGER</dataType>
				<type>MEASURE</type>
				<name>Integer</name>
			</column>
			<column>
				<dataType>CURRENCY</dataType>
				<type>MEASURE</type>
				<name>Currency</name>
			</column>
			<column>
				<dataType>PERCENT</dataType>
				<type>MEASURE</type>
				<name>Percent</name>
			</column>
			<column>
				<dataType>DATE</dataType>
				<type>DIMENSION</type>
				<name>Date</name>
			</column>
			<column>
				<dataType>DATETIME</dataType>
				<type>DIMENSION</type>
				<name>DateTime</name>
			</column>
			<column>
				<dataType>TIMESTAMP</dataType>
				<type>DIMENSION</type>
				<name>TimeStamp</name>
			</column>
			<column>
				<dataType>BOOLEAN</dataType>
				<type>DIMENSION</type>
				<name>Boolean</name>
			</column>
			<column>
				<dataType>VERSION</dataType>
				<type>DIMENSION</type>
				<name>Version</name>
			</column>
			<column>
				<dataType>DECIMAL</dataType>
				<type>MEASURE</type>
				<name>Decimal</name>
			</column>
			<column>
				<dataType>DOUBLE</dataType>
				<type>MEASURE</type>
				<name>Double</name>
			</column>
		</columns>
</schema>

